Name	title	coding
t3_qqi45f	Students who live alone. How you manage it out and what is your budget	r
t3_qple7p	Did not meet the requirements on conditional offer	o
t3_qlcvar	btm 200 online	c
t3_qmx5wu	What's going on at Space Concordia	o
t3_qm1eee	Teamwork with 10 teammates	o
t3_ql2ywv	Does the FG building connect to the John Molson building?	o
t3_qptic5	What kind of phone do you use? (Survey for a class)	c
t3_qouo3n	COMM 205	c
t3_qplp47	Conconrdia Engr courses attendance policy	c
t3_qm2jtm	Absolute professor dilemma-&gt; Anthony Noce or Anca Alecsandru	c
t3_qoxt8d	What would people say is the easiest math course to take a Concordia?	c
t3_qp5j44	Concordia or uwindsor	o
t3_qm5my8	looking for paid tutorials	c
t3_qpl6dx	Work-study program	o
t3_qmry9i	Relevent post, this scammer is around Concordia (St. Catherines just west of rue Guy)	o
t3_qq5d1b	COMP 335 Syllabus	c
t3_qngpnq	MATH 204, MATH 205 delivery question	c
t3_qo26js	Permanent code international student.	o
t3_qlyd20	CAQ and Study Permit	o
t3_qn079w	Soccer Tournament	o
t3_qp6olo	Anyone here doing options trading	o
t3_qmnj38	Freshman Questions	o
t3_qpvjxz	DISC Inquiry	c
t3_qqpo5q	Don’t go to Concordia for arts	o
t3_qmopar	Survey for our Statistics Class! :)	c
t3_qmz7j7	Can anyone share the Econ 301 course outline with me?	c
t3_qo535h	Im in Software Engineering and I have two options next semester. Either to take the ENGR 233 with Chantal David but take the SOEN 228 with Donald Peter Davies. OR take ENGR 233 with Alexei Kokotov but take SOEN 228 with Hakim Mella . Which option should I go for?	c
t3_qmoiy3	Do I have hope to pass my class?	c
t3_qn0dnv	Self-study source for MATH and PHYS	c
t3_qp2lc5	SOS tutoring for Math 209	c
t3_qndfs9	Is there a limit to how many DISC you can have?	c
t3_qnf3mt	To do checklist on student centre after I applied (I'm international so it asks for like visa expense documents, etc), do I need to do it before or after I have a decision?	o
t3_qqb0oc	Comp 218	c
t3_qmm8cj	Math 204 Advice ?	c
t3_qprn6y	Final year worries	o
t3_qlkt9z	STL (Laval Buses) Strike: November 3rd, 15th, 26th	o
t3_qpr2og	Guys , what’s the best website/app to find apartments for rent for students?	r
t3_qpuhjr	Have four courses, planning to disc one tonight. Would I become a part time student?	c
t3_qlgutl	Can we Petition Removal Of A Prof From A Teaching Position?	o
t3_qpxh7l	PHYS 206 - Route of least resistance?	c
t3_qlvcl8	How is Nicolas Lepage-Saucier as a teacher?	c
t3_qnb3i5	Is a tutor allowed to give a quiz after stating no quiz would be given?	o
t3_qly38g	COURSE QUESTION	c
t3_qq6isg	PHYS204	c
t3_qmavtc	Unable to DISC co-requisite course	c
t3_qqm6kf	AFE Financial Aid Question	o
t3_qoamk1	Comm 210 help	c
t3_qnccmc	Study Permit rant	o
t3_qphn14	Chance of concentration mechanical Beng to Soen	o
t3_qpp2m2	Retaking a course	c